{
  "$ref": "#/definitions/reading",
  "definitions": {
    "reading": {
      "type": "object",
      "properties": {
        "title": {
          "type": "string"
        },
        "url": {
          "type": "string",
          "format": "uri"
        },
        "author": {
          "type": "string"
        },
        "source": {
          "type": "string"
        },
        "description": {
          "type": "string"
        },
        "dateAdded": {
          "anyOf": [
            {
              "type": "string",
              "format": "date-time"
            },
            {
              "type": "string",
              "format": "date"
            },
            {
              "type": "integer",
              "format": "unix-time"
            }
          ]
        },
        "tags": {
          "type": "array",
          "items": {
            "type": "string"
          },
          "default": []
        },
        "$schema": {
          "type": "string"
        }
      },
      "required": [
        "title",
        "url",
        "dateAdded"
      ],
      "additionalProperties": false
    }
  },
  "$schema": "http://json-schema.org/draft-07/schema#"
}