{
  "title": "A Philosophy of Software Design",
  "url": "https://www.amazon.com/Philosophy-Software-Design-John-Ousterhout/dp/1732102201",
  "author": "John Ousterhout",
  "source": "Book",
  "description": "The best book on software design I've read. Ousterhout argues that the primary goal of good design is to reduce complexity, and lays out concrete principles to get there.",
  "dateAdded": "2025-01-05",
  "tags": ["books", "design", "engineering"]
}
