{
  "title": "Choose Boring Technology",
  "url": "https://mcfunley.com/choose-boring-technology",
  "author": "Dan McKinley",
  "source": "mcfunley.com",
  "description": "A classic argument for why picking dull, well-understood tools is often the most intellectually honest engineering decision.",
  "dateAdded": "2024-11-10",
  "tags": ["engineering", "architecture"]
}
