{
  "title": "The Grug Brained Developer",
  "url": "https://grugbrain.dev",
  "author": "Carson Gross",
  "source": "grugbrain.dev",
  "description": "A loveable manifesto against complexity, written in the voice of a prehistoric developer who fears the complexity spirit demon.",
  "dateAdded": "2024-12-01",
  "tags": ["engineering", "simplicity", "humor"]
}
